{
  "schema_version": "fairiagent.benchmark_manifest.v2",
  "benchmark_release": "development.v2.smoke",
    "instances": [
    {
      "instance_id": "fixture_document",
      "source_path": "document.md",
      "ground_truth_path": "ground_truth.json",
      "package_id": "fixture_package",
      "package_version": "1",
      "split": "development",
      "strata": {"layout": "table_heavy", "domain": "synthetic"}
    }
  ],
  "conditions": [
    {
      "condition_id": "complete_fairiagent_system",
      "publication_name": "Complete FAIRiAgent system",
      "component_settings": {"deterministic_correction": true}
    }
  ],
  "models": [
    {
      "model_id": "fixture_model",
      "provider": "fixture",
      "model_name": "fixture-model",
      "endpoint_class": "snapshot",
      "configuration_hash": "fixture"
    }
  ],
  "scheduled_runs": [
    {
      "run_id": "fixture_document__complete_fairiagent_system__fixture_model__r01",
      "instance_id": "fixture_document",
      "condition_id": "complete_fairiagent_system",
      "model_id": "fixture_model",
      "repetition": 1
    },
    {
      "run_id": "fixture_document__complete_fairiagent_system__fixture_model__r02",
      "instance_id": "fixture_document",
      "condition_id": "complete_fairiagent_system",
      "model_id": "fixture_model",
      "repetition": 2
    },
    {
      "run_id": "fixture_document__complete_fairiagent_system__fixture_model__r03",
      "instance_id": "fixture_document",
      "condition_id": "complete_fairiagent_system",
      "model_id": "fixture_model",
      "repetition": 3
    }
  ],
    "provenance": {
      "repository_commit": "fixture",
      "evaluator_version": "fixture-v2",
      "created_at": "2026-07-21T00:00:00Z",
      "fixture": true
    }
}
